{
  "$schema": "https://json-schema.org/draft/2020-12/schema",
  "$id": "https://raw.githubusercontent.com/api-evangelist/oracle-cloud/refs/heads/main/json-schema/oke-node-pool-schema.json",
  "title": "NodePool",
  "description": "A node pool in a Kubernetes cluster.",
  "type": "object",
  "properties": {
    "id": {
      "type": "string",
      "example": "ocid1.resource.oc1.iad.abcdefg123456"
    },
    "clusterId": {
      "type": "string",
      "example": "ocid1.resource.oc1.iad.abcdefg123456"
    },
    "compartmentId": {
      "type": "string",
      "example": "ocid1.resource.oc1.iad.abcdefg123456"
    },
    "name": {
      "type": "string",
      "example": "pool1"
    },
    "kubernetesVersion": {
      "type": "string",
      "example": "v1.28.2"
    },
    "nodeShape": {
      "type": "string",
      "example": "VM.Standard.E4.Flex"
    },
    "quantityPerSubnet": {
      "type": "integer",
      "example": 3
    },
    "lifecycleState": {
      "type": "string",
      "example": "example-value"
    },
    "timeCreated": {
      "type": "string",
      "format": "date-time",
      "example": "2026-04-18T10:30:00Z"
    }
  }
}